Speed Full
Device Descriptor:
  bLength                18
  bDescriptorType         1
  bcdUSB               2.00
  bDeviceClass            0 (Defined at Interface level)
  bDeviceSubClass         0
  bDeviceProtocol         0
  bMaxPacketSize0         64
  idVendor           0x3340 abcd
  idProduct          0x3457 abcd
  bcdDevice            1.00
  iManufacturer           1
  iProduct                2
  iSerial                 3
  bNumConfigurations      1
    Configuration Descriptor:
    bLength                 9
    bDescriptorType         2
    wTotalLength           41
    bNumInterfaces          2
    bConfigurationValue     1
    iConfiguration          0
    bmAttributes         0x80
      (Bus Powered)
    MaxPower               98mA
  Interface Descriptor:
      bLength                 9
      bDescriptorType         4
      bInterfaceNumber        0
      bAlternateSetting       0
      bNumEndpoints           1
      bInterfaceClass         0 Mass Storage
      bInterfaceSubClass      0 SCSI
      bInterfaceProtocol      0 Bulk-Only
      iInterface              0
        Endpoint Descriptor:
          bLength                 7
          bDescriptorType         5
          bEndpointAddress     0x01  EP 1 OUT
          bmAttributes            2
          Transfer Type            Bulk
          Synch Type               None
          Usage Type               Data
          wMaxPacketSize     0x0200  1x 512 bytes
          bInterval               1
    Interface Descriptor:
      bLength                 9
      bDescriptorType         4
      bInterfaceNumber        1
      bAlternateSetting       0
      bNumEndpoints           1
      bInterfaceClass         0 Mass Storage
      bInterfaceSubClass      0 SCSI
      bInterfaceProtocol      0 Bulk-Only
      iInterface              0
        Endpoint Descriptor:
          bLength                 7
          bDescriptorType         5
          bEndpointAddress     0x01  EP 1 OUT
          bmAttributes            2
          Transfer Type            Bulk
          Synch Type               None
          Usage Type               Data
          wMaxPacketSize     0x0200  1x 512 bytes
          bInterval               1
