Speed Full
Device Descriptor:
  bLength                18
  bDescriptorType         1
  bcdUSB               2.00
  bDeviceClass            0 (Defined at Interface level)
  bDeviceSubClass         0
  bDeviceProtocol         0
  bMaxPacketSize0         64
  idVendor           0x3340 abcd
  idProduct          0x3457 abcd
  bcdDevice            1.00
  iManufacturer           1
  iProduct                2
  iSerial                 3
  bNumConfigurations      1
  Configuration Descriptor:
    bLength                 9
    bDescriptorType         2
    wTotalLength           27
    bNumInterfaces          1
    bConfigurationValue     1
    iConfiguration          0
    bmAttributes         0x80
      (Bus Powered)
    MaxPower               98mA
    Interface Descriptor:
      bLength                 9
      bDescriptorType         4
      bInterfaceNumber        0
      bAlternateSetting       0
      bNumEndpoints           0
      bInterfaceClass         0 Mass Storage
      bInterfaceSubClass      0 SCSI
      bInterfaceProtocol      0 Bulk-Only
      iInterface              0
